{
  "schema_version": 1, "identity_strength": "registry_pinned", "pipeline_kind": "video_generation",
  "display": {"alias": "sample-video"},
  "components": [
    {"component_id": "primary", "role": "primary", "source": {"kind": "huggingface", "repo_id": "example-org/sample-video", "resolved_revision": "3333333333333333333333333333333333333333", "subfolder": "transformer"}, "artifact": {"format": "safetensors", "manifest_digest": "sha256:7777777777777777777777777777777777777777777777777777777777777777", "manifest_basis": "huggingface_tree"}, "quantization": {"kind": "weights", "method": "affine", "weight_bits_x2": 8}},
    {"component_id": "text-encoder", "role": "text_encoder", "source": {"kind": "huggingface", "repo_id": "example-org/sample-video", "resolved_revision": "3333333333333333333333333333333333333333", "subfolder": "text_encoder"}, "artifact": {"format": "safetensors", "manifest_digest": "sha256:8888888888888888888888888888888888888888888888888888888888888888", "manifest_basis": "huggingface_tree"}, "quantization": {"kind": "none", "base_dtype": "bfloat16"}},
    {"component_id": "vae", "role": "vae", "source": {"kind": "huggingface", "repo_id": "example-org/sample-video", "resolved_revision": "3333333333333333333333333333333333333333", "subfolder": "vae"}, "artifact": {"format": "safetensors", "manifest_digest": "sha256:9999999999999999999999999999999999999999999999999999999999999999", "manifest_basis": "huggingface_tree"}, "quantization": {"kind": "none", "base_dtype": "bfloat16"}}
  ],
  "identity_digest": "sha256:e27590cde854696c942f81c58e384025c7914795e2e10997fbc60e133ad0589c"
}
